{
  "title": "Atomic Habits",
  "author": "James Clear",
  "totalPages": 320,
  "currentPage": 96,
  "status": "paused",
  "category": "non-fiction",
  "language": "en",
  "startDate": "2026-04-03",
  "notes": "Paused after the first chapters to demonstrate a non-active unfinished book.",
  "tags": [
    "habits",
    "personal-systems"
  ]
}
