{
  "title": "Mistborn: O Império Final",
  "author": "Brandon Sanderson",
  "totalPages": 720,
  "currentPage": 209,
  "status": "reading",
  "category": "fantasy",
  "genres": [
    "epic-fantasy",
    "high-fantasy",
    "dark-fantasy"
  ],
  "language": "pt",
  "startDate": "2025-09-03",
  "isbn": "978-65-81339-18-0",
  "publisher": "Trama",
  "year": 2025,
  "notes": "3ª edição brasileira publicada pela Trama (2025).\nTítulo original: Mistborn: The Final Empire.\nTradução: Marcia Blasques.",
  "tags": [
    "mistborn",
    "cosmere"
  ],
  "coverUrl": "https://cdn.awsli.com.br/2444/2444709/produto/340110044/mistborn_frente-zq1luckoak.png"
}
