{
  "title": "Dune",
  "author": "Frank Herbert",
  "totalPages": 412,
  "currentPage": 412,
  "status": "completed",
  "category": "science-fiction",
  "genres": [
    "space-opera",
    "political-fiction"
  ],
  "language": "en",
  "startDate": "2026-01-05",
  "endDate": "2026-02-02",
  "isbn": "978-0-441-17271-9",
  "publisher": "Ace Books",
  "year": 1965,
  "tags": [
    "classic",
    "completed-2026"
  ]
}
